{
  "id": "URG-016",
  "titulo": "Joven que tomo veneno para plagas",
  "area": "MI",
  "subarea": "Urgencias: intoxicacion aguda por inhibidor de colinesterasa",
  "dificultad": 3,
  "estado": "BORRADOR",
  "tipo": "medico",
  "nivelesDisponibles": [1, 2, 3],
  "tiempoSugeridoSeg": 1800,
  "notaDeAutoria": "La vineta clinica y los resultados de estudios los redacto el autor del caso para que apliquen los criterios de la fuente; NO provienen de un paciente real ni de un caso publicado. Todo el contenido evaluable (definicion de caso sospechoso, manifestaciones, examenes, diferenciales, medidas por nivel, descontaminacion, antidotos, criterios de referencia y alta, prevencion) proviene del capitulo 16 'Intoxicacion Aguda por Inhibidor de Colinesterasa' de la Norma Nacional de Atencion Clinica de Urgencias y Emergencias (fuente 0), con la pagina indicada en cada item. La tabla de antidotos de la fuente (p. 151) esta desalineada en el PDF: se tomo la dosis de atropina, la de oximas y la frase 'no esta indicada por el alto volumen de distribucion' como referida a la hemodialisis; conviene confirmarlo en el impreso. Los nivelMinimo de los estudios se anclan a las normas de caracterizacion de primer nivel (fuente 1) y segundo nivel (fuente 2); en el juego, nivel 1 es el Centro de Salud con Internacion. Estado BORRADOR: falta verificar cada pagina contra el PDF y la revision por una segunda persona del area.",
  "presentacionInicial": {
    "texto": "Varon de 19 anos traido por su madre. Hace unos 40 minutos, despues de una discusion en casa, tomo un liquido de una botella de insecticida que usan en la chacra. Vomito dos veces en el camino. Esta sudoroso, babea y dice que ve borroso. La madre trae la botella en una bolsa.",
    "signosVitales": {
      "Presion arterial": "90/60 mmHg",
      "Frecuencia cardiaca": "48 lpm",
      "Frecuencia respiratoria": "28 por minuto",
      "Temperatura": "35.9 C",
      "Saturacion de oxigeno": "88% (aire ambiente)"
    },
    "contexto": "Puedes jugar este caso en primer, segundo o tercer nivel de atencion. El nivel cambia que estudios estan disponibles y cual es la conducta que la norma espera de ti."
  },
  "descubrimiento": {
    "anamnesis": {
      "etiqueta": "Interrogar al paciente y a la madre",
      "exigeDeclaracionPrevia": true,
      "items": [
        { "clave": "producto", "texto": "La etiqueta de la botella dice 'Clorpirifos'. Es un insecticida que su padre usa para la papa.", "critico": true },
        { "clave": "tiempo", "texto": "Lo tomo hace unos 40 minutos. La madre calcula que fue 'un trago grande'.", "critico": true },
        { "clave": "via", "texto": "Lo tomo por la boca. Al tomarlo se le chorreo sobre la camisa, que todavia tiene puesta y huele a quimico.", "critico": true },
        { "clave": "intencion", "texto": "Al preguntarle a solas, dice que lo tomo porque 'ya no queria seguir'. Es la primera vez que hace algo asi.", "critico": true },
        { "clave": "sintomas_gi", "texto": "Tiene nauseas, vomito dos veces, colicos y una deposicion liquida en el camino.", "critico": true },
        { "clave": "otros_toxicos", "texto": "Niega haber tomado alcohol, medicamentos u otro producto." }
      ]
    },
    "antecedentes": {
      "etiqueta": "Antecedentes",
      "exigeDeclaracionPrevia": true,
      "items": [
        { "clave": "psiquiatrico", "texto": "La madre cuenta que en los ultimos meses esta aislado y duerme mal. Nunca fue atendido por psicologia ni psiquiatria." },
        { "clave": "alergias", "texto": "No tiene alergias conocidas a medicamentos." },
        { "clave": "comorbilidad", "texto": "Sano. No toma ningun medicamento. Vacunas al dia segun la madre." }
      ]
    },
    "examenFisico": {
      "etiqueta": "Examinar al paciente",
      "exigeDeclaracionPrevia": true,
      "items": [
        { "clave": "conciencia", "texto": "Despierto, ansioso, responde a ordenes. Glasgow 15/15. No convulsiona.", "critico": true },
        { "clave": "pupilas", "texto": "Miosis bilateral puntiforme. Lagrimeo abundante.", "critico": true },
        { "clave": "secreciones", "texto": "Sialorrea abundante. Sudoracion profusa en todo el cuerpo.", "critico": true },
        { "clave": "pulmones", "texto": "Crepitantes y roncus difusos en ambos campos por abundantes secreciones bronquiales. Sibilancias espiratorias.", "critico": true },
        { "clave": "musculos", "texto": "Fasciculaciones en parpados, cara y musculos del torax. Fuerza muscular disminuida en las cuatro extremidades.", "critico": true },
        { "clave": "cardio_ex", "texto": "Bradicardia regular. Pulsos perifericos debiles. Llenado capilar de 3 segundos." },
        { "clave": "piel_ropa", "texto": "Camisa humeda con el producto en el pecho. Piel del torax sin lesiones visibles." }
      ]
    },
    "laboratorio": {
      "etiqueta": "Laboratorio",
      "items": [
        {
          "clave": "hemograma",
          "nombre": "Hemograma",
          "resultado": "Leucocitos 13.200/mm3. Hematocrito 46%. Plaquetas normales.",
          "nivelMinimo": 1,
          "fuente": 0,
          "nivelFuente": 1,
          "nivelPagina": "37, 121",
          "nivelNota": "La norma de primer nivel asigna laboratorio basico al Centro de Salud con Internacion, con analizador hematologico, contador diferencial y lector de hematocrito.",
          "nivelAnclaje": "COMPLETO"
        },
        {
          "clave": "bioquimica",
          "nombre": "Glucemia, urea y creatinina",
          "resultado": "Glucemia 186 mg/dl. Urea 30 mg/dl. Creatinina 0.9 mg/dl.",
          "nivelMinimo": 2,
          "fuente": 0,
          "nivelFuente": 1,
          "nivelPagina": "121, 204",
          "nivelNota": "El laboratorio basico del Centro de Salud con Internacion no lista equipo de bioquimica (norma de primer nivel, p. 121); la bioquimica aparece en el laboratorio completo del Centro de Salud Integral (p. 204). Falta confirmar el detalle en la norma de segundo nivel (cap. XIII, aun no descargado).",
          "nivelAnclaje": "PARCIAL"
        },
        {
          "clave": "colinesterasa",
          "nombre": "Colinesterasa plasmatica",
          "resultado": "Actividad marcadamente disminuida respecto del rango normal del laboratorio (1020-3460 U/L).",
          "nivelMinimo": 2,
          "fuente": 0
        },
        {
          "clave": "amilasa",
          "nombre": "Amilasa",
          "resultado": "Dentro de valores normales.",
          "nivelMinimo": 2,
          "fuente": 0
        }
      ]
    },
    "gabinete": {
      "etiqueta": "Gabinete",
      "items": [
        {
          "clave": "ecg",
          "nombre": "Electrocardiograma",
          "resultado": "Bradicardia sinusal de 46 lpm. Sin bloqueos. QTc en limite superior.",
          "nivelMinimo": 2,
          "fuente": 0,
          "nivelFuente": 1,
          "nivelPagina": "119-121",
          "nivelNota": "El electrocardiografo no figura en el equipamiento del Centro de Salud con Internacion (norma de primer nivel, pp. 119-121). Falta confirmar que este en segundo nivel (cap. XII o XIII de esa norma, aun no descargados).",
          "nivelAnclaje": "PARCIAL"
        },
        {
          "clave": "rxtorax",
          "nombre": "Radiografia de torax",
          "resultado": "Infiltrados bilaterales difusos de tipo alveolar, sin condensacion lobar. Sin derrame.",
          "nivelMinimo": 2,
          "fuente": 0,
          "nivelFuente": 2,
          "nivelPagina": "77, 102",
          "nivelNota": "En primer nivel solo el Centro de Salud Integral tiene radiologia e imagenologia (norma de primer nivel, Cuadro No 5, p. 37); el hospital de segundo nivel cuenta con imagenologia y ambiente de radiologia (norma de segundo nivel, pp. 77 y 102).",
          "nivelAnclaje": "COMPLETO"
        }
      ]
    }
  },
  "estudiosPlausiblesNoIncluidos": [
    {
      "nombre": "Gasometria arterial",
      "preguntaTribunal": "Pidio gasometria arterial. Mientras llega el resultado, con que parametros de la cabecera decide si la atropinizacion es suficiente?",
      "comentarioFuente": "La fuente la incluye entre otros estudios segun organo afectado y disponibilidad (p. 148); el caso no contempla su resultado.",
      "fuente": 0
    },
    {
      "nombre": "Hepatograma",
      "preguntaTribunal": "Pidio hepatograma. Que esperaba encontrar y que decision cambiaria?",
      "comentarioFuente": "La fuente lo lista entre los examenes complementarios (p. 148); el caso no contempla su resultado.",
      "fuente": 0
    },
    {
      "nombre": "Ionograma",
      "preguntaTribunal": "Pidio ionograma. Justifique la indicacion en este paciente.",
      "comentarioFuente": "La fuente lo incluye segun organo afectado y disponibilidad (p. 148); el caso no contempla su resultado.",
      "fuente": 0
    },
    {
      "nombre": "ELISA para VIH",
      "preguntaTribunal": "Pidio ELISA para VIH. Que requisito exige la fuente antes de tomarlo?",
      "comentarioFuente": "La fuente lo lista previo consentimiento informado (p. 148); el caso no contempla su resultado.",
      "fuente": 0
    }
  ],
  "rubrica": {
    "diagnosticosEsperados": [
      {
        "clave": "dx_intox",
        "texto": "Intoxicacion aguda por inhibidor de colinesterasa: compuesto organofosforado (CIE-10 T60.0)",
        "valoracion": "ESPERADO",
        "fuente": 0,
        "pagina": "142, 145",
        "sinonimos": ["intoxicacion por organofosforados", "organofosforado", "intoxicacion por inhibidor de colinesterasa", "inhibidores de la colinesterasa", "intoxicacion por plaguicida", "intoxicacion por insecticida", "clorpirifos", "cofa"],
        "conceptoLigado": "c_caso_sospechoso"
      },
      {
        "clave": "dx_toxindrome",
        "texto": "Toxindrome colinergico con efectos muscarinicos, nicotinicos y sobre el sistema nervioso central",
        "valoracion": "ESPERADO",
        "fuente": 0,
        "pagina": "145, 147",